{
  "schemaVersion": "1.0",
  "programmeId": "company-swarm-build-20261011",
  "status": "proposal",
  "authority": "Existing private portfolio Registry and product permissions; this file grants none",
  "sourcePins": {
    "registry": "b4b82e3d1430846d62707973a66584de4f2e4776",
    "visRemoteMain": "812c538cdc2f773cd0735ffb49edbeac0b0116e9",
    "rejectedBriefRevision": "a4d85dbb1b70b21ac41cad3f666f63c4027a544b",
    "refreshBeforeExecution": true
  },
  "admission": {
    "admitted": false,
    "executionStarted": false,
    "requiresTrustedServerReceipt": true,
    "workersStarted": 0,
    "reason": "Local PP HOLD; implementation and independent release evidence pending",
    "actualBudgetsRequired": true
  },
  "teamPolicy": {
    "rolesPerActivePack": [
      3,
      5
    ],
    "coordinatorCount": 1,
    "distinctVerifierRequired": true,
    "oneWriterPerWorktree": true,
    "parallelism": "Minimum of admission, native slots and independent scopes; zero under HOLD"
  },
  "waves": [
    "W0",
    "W1",
    "W2",
    "W3",
    "W4",
    "W5"
  ],
  "lanes": [
    {
      "id": "S00",
      "name": "Portfolio, customer outcome and economics",
      "wave": "W0",
      "dependsOn": [],
      "admitted": false,
      "repo": null,
      "origin": null,
      "baseRevision": null,
      "branch": null,
      "owner": null,
      "files": [],
      "actualCashCap": null,
      "actualTimeLimit": null,
      "prompt": "../COMPANY-SWARM-LANE-PROMPTS.md#s00-portfolio-customer-outcome-and-economics",
      "evaluationIds": [],
      "requiredAssignmentFields": [
        "repo",
        "origin",
        "baseRevision",
        "branch",
        "owner",
        "files",
        "actualCashCap",
        "actualTimeLimit",
        "permittedInputs",
        "permittedActions",
        "acceptance",
        "stopCondition"
      ],
      "stopOn": [
        "missing ownership or guide",
        "unresolved authority",
        "budget/resource hold",
        "critical security/recovery defect"
      ]
    },
    {
      "id": "S01",
      "name": "Admission and assignment compilation",
      "wave": "W0",
      "dependsOn": [
        "S00"
      ],
      "admitted": false,
      "repo": null,
      "origin": null,
      "baseRevision": null,
      "branch": null,
      "owner": null,
      "files": [],
      "actualCashCap": null,
      "actualTimeLimit": null,
      "prompt": "../COMPANY-SWARM-LANE-PROMPTS.md#s01-admission-and-assignment-compilation",
      "evaluationIds": [
        "E02",
        "E28"
      ],
      "requiredAssignmentFields": [
        "repo",
        "origin",
        "baseRevision",
        "branch",
        "owner",
        "files",
        "actualCashCap",
        "actualTimeLimit",
        "permittedInputs",
        "permittedActions",
        "acceptance",
        "stopCondition"
      ],
      "stopOn": [
        "missing ownership or guide",
        "unresolved authority",
        "budget/resource hold",
        "critical security/recovery defect"
      ]
    },
    {
      "id": "S02",
      "name": "Shared domain operations and identity",
      "wave": "W1",
      "dependsOn": [
        "S00",
        "S01"
      ],
      "admitted": false,
      "repo": null,
      "origin": null,
      "baseRevision": null,
      "branch": null,
      "owner": null,
      "files": [],
      "actualCashCap": null,
      "actualTimeLimit": null,
      "prompt": "../COMPANY-SWARM-LANE-PROMPTS.md#s02-shared-domain-operations-and-identity",
      "evaluationIds": [
        "E01",
        "E03"
      ],
      "requiredAssignmentFields": [
        "repo",
        "origin",
        "baseRevision",
        "branch",
        "owner",
        "files",
        "actualCashCap",
        "actualTimeLimit",
        "permittedInputs",
        "permittedActions",
        "acceptance",
        "stopCondition"
      ],
      "stopOn": [
        "missing ownership or guide",
        "unresolved authority",
        "budget/resource hold",
        "critical security/recovery defect"
      ]
    },
    {
      "id": "S03",
      "name": "Storage and catalog authority",
      "wave": "W1",
      "dependsOn": [
        "S02"
      ],
      "admitted": false,
      "repo": null,
      "origin": null,
      "baseRevision": null,
      "branch": null,
      "owner": null,
      "files": [],
      "actualCashCap": null,
      "actualTimeLimit": null,
      "prompt": "../COMPANY-SWARM-LANE-PROMPTS.md#s03-storage-and-catalog-authority",
      "evaluationIds": [
        "E08",
        "E09",
        "E10"
      ],
      "requiredAssignmentFields": [
        "repo",
        "origin",
        "baseRevision",
        "branch",
        "owner",
        "files",
        "actualCashCap",
        "actualTimeLimit",
        "permittedInputs",
        "permittedActions",
        "acceptance",
        "stopCondition"
      ],
      "stopOn": [
        "missing ownership or guide",
        "unresolved authority",
        "budget/resource hold",
        "critical security/recovery defect"
      ]
    },
    {
      "id": "S04",
      "name": "DAM browsing and operator experience",
      "wave": "W2",
      "dependsOn": [
        "S03"
      ],
      "admitted": false,
      "repo": null,
      "origin": null,
      "baseRevision": null,
      "branch": null,
      "owner": null,
      "files": [],
      "actualCashCap": null,
      "actualTimeLimit": null,
      "prompt": "../COMPANY-SWARM-LANE-PROMPTS.md#s04-dam-browsing-and-operator-experience",
      "evaluationIds": [
        "E11",
        "E25"
      ],
      "requiredAssignmentFields": [
        "repo",
        "origin",
        "baseRevision",
        "branch",
        "owner",
        "files",
        "actualCashCap",
        "actualTimeLimit",
        "permittedInputs",
        "permittedActions",
        "acceptance",
        "stopCondition"
      ],
      "stopOn": [
        "missing ownership or guide",
        "unresolved authority",
        "budget/resource hold",
        "critical security/recovery defect"
      ]
    },
    {
      "id": "S05",
      "name": "CMS and editorial asset placement",
      "wave": "W2",
      "dependsOn": [
        "S02",
        "S03"
      ],
      "admitted": false,
      "repo": null,
      "origin": null,
      "baseRevision": null,
      "branch": null,
      "owner": null,
      "files": [],
      "actualCashCap": null,
      "actualTimeLimit": null,
      "prompt": "../COMPANY-SWARM-LANE-PROMPTS.md#s05-cms-and-editorial-asset-placement",
      "evaluationIds": [
        "E06"
      ],
      "requiredAssignmentFields": [
        "repo",
        "origin",
        "baseRevision",
        "branch",
        "owner",
        "files",
        "actualCashCap",
        "actualTimeLimit",
        "permittedInputs",
        "permittedActions",
        "acceptance",
        "stopCondition"
      ],
      "stopOn": [
        "missing ownership or guide",
        "unresolved authority",
        "budget/resource hold",
        "critical security/recovery defect"
      ]
    },
    {
      "id": "S06",
      "name": "CRM, acquisition intelligence and data quality",
      "wave": "W4",
      "dependsOn": [
        "S00",
        "S02"
      ],
      "admitted": false,
      "repo": null,
      "origin": null,
      "baseRevision": null,
      "branch": null,
      "owner": null,
      "files": [],
      "actualCashCap": null,
      "actualTimeLimit": null,
      "prompt": "../COMPANY-SWARM-LANE-PROMPTS.md#s06-crm-acquisition-intelligence-and-data-quality",
      "evaluationIds": [
        "E24"
      ],
      "requiredAssignmentFields": [
        "repo",
        "origin",
        "baseRevision",
        "branch",
        "owner",
        "files",
        "actualCashCap",
        "actualTimeLimit",
        "permittedInputs",
        "permittedActions",
        "acceptance",
        "stopCondition"
      ],
      "stopOn": [
        "missing ownership or guide",
        "unresolved authority",
        "budget/resource hold",
        "critical security/recovery defect"
      ]
    },
    {
      "id": "S07",
      "name": "Durable workflows and integration recovery",
      "wave": "W1",
      "dependsOn": [
        "S02"
      ],
      "admitted": false,
      "repo": null,
      "origin": null,
      "baseRevision": null,
      "branch": null,
      "owner": null,
      "files": [],
      "actualCashCap": null,
      "actualTimeLimit": null,
      "prompt": "../COMPANY-SWARM-LANE-PROMPTS.md#s07-durable-workflows-and-integration-recovery",
      "evaluationIds": [
        "E04",
        "E05"
      ],
      "requiredAssignmentFields": [
        "repo",
        "origin",
        "baseRevision",
        "branch",
        "owner",
        "files",
        "actualCashCap",
        "actualTimeLimit",
        "permittedInputs",
        "permittedActions",
        "acceptance",
        "stopCondition"
      ],
      "stopOn": [
        "missing ownership or guide",
        "unresolved authority",
        "budget/resource hold",
        "critical security/recovery defect"
      ]
    },
    {
      "id": "S08",
      "name": "API, CLI, MCP and host connections",
      "wave": "W2",
      "dependsOn": [
        "S02",
        "S07"
      ],
      "admitted": false,
      "repo": null,
      "origin": null,
      "baseRevision": null,
      "branch": null,
      "owner": null,
      "files": [],
      "actualCashCap": null,
      "actualTimeLimit": null,
      "prompt": "../COMPANY-SWARM-LANE-PROMPTS.md#s08-api-cli-mcp-and-host-connections",
      "evaluationIds": [
        "E13",
        "E14"
      ],
      "requiredAssignmentFields": [
        "repo",
        "origin",
        "baseRevision",
        "branch",
        "owner",
        "files",
        "actualCashCap",
        "actualTimeLimit",
        "permittedInputs",
        "permittedActions",
        "acceptance",
        "stopCondition"
      ],
      "stopOn": [
        "missing ownership or guide",